[
  {
    "id": "SYN-DEMO-001",
    "label": "Synthetic chest radiograph normal demo",
    "synthetic": true,
    "schemaVersion": "1.0.0-public-synthetic",
    "exam": "Radiografia de torax, demonstracao sintetica, sem contraste.",
    "findings": "Texto sintetico para teste de harness. Campos pulmonares sem opacidades focais. Silhueta cardiomediastinal dentro dos limites esperados para o exemplo. Sem derrame pleural ou pneumotorax.",
    "locale": "pt-BR",
    "tags": ["synthetic", "demo", "XR", "chest"],
    "goldFindings": [
      { "finding": "sem opacidades focais", "severity": "minor", "negated": true },
      { "finding": "sem derrame pleural", "severity": "minor", "negated": true },
      { "finding": "sem pneumotorax", "severity": "major", "negated": true }
    ],
    "referenceReport": "<center><b>RADIOGRAFIA DE TORAX - EXEMPLO SINTETICO</b></center><br><b>Achados</b><br>Sem opacidades focais, derrame pleural ou pneumotorax no exemplo sintetico.<br><b>Conclusao</b><br>Exemplo sintetico sem achados agudos.",
    "criticalFindings": [],
    "guidelineExpectations": [],
    "patientContext": { "indication": "Demonstracao sintetica sem dados reais." },
    "difficulty": "easy"
  },
  {
    "id": "SYN-DEMO-002",
    "label": "Synthetic head CT urgent finding demo",
    "synthetic": true,
    "schemaVersion": "1.0.0-public-synthetic",
    "exam": "Tomografia computadorizada de cranio, demonstracao sintetica, sem contraste.",
    "findings": "Texto sintetico para teste de preservacao de achado critico. Pequena colecao extra-axial hiperatenue frontoparietal direita, com discreto efeito de massa local. Sem desvio da linha media no exemplo. Cisternas basais preservadas.",
    "locale": "pt-BR",
    "tags": ["synthetic", "demo", "CT", "head", "critical-finding"],
    "goldFindings": [
      { "finding": "colecao extra-axial hiperatenue", "location": "frontoparietal", "laterality": "right", "severity": "critical" },
      { "finding": "discreto efeito de massa local", "severity": "major" },
      { "finding": "sem desvio da linha media", "severity": "major", "negated": true }
    ],
    "referenceReport": "<center><b>TC DE CRANIO - EXEMPLO SINTETICO</b></center><br><b>Achados</b><br>Pequena colecao extra-axial hiperatenue frontoparietal direita, com discreto efeito de massa local. Sem desvio da linha media.<br><b>Conclusao</b><br>Exemplo sintetico de achado extra-axial critico que deve ser preservado no resumo.",
    "criticalFindings": ["colecao extra-axial hiperatenue frontoparietal direita"],
    "guidelineExpectations": [],
    "patientContext": { "indication": "Demonstracao sintetica de preservacao de achado critico." },
    "difficulty": "medium"
  },
  {
    "id": "SYN-DEMO-003",
    "label": "Synthetic abdominal ultrasound gallstone demo",
    "synthetic": true,
    "schemaVersion": "1.0.0-public-synthetic",
    "exam": "Ultrassonografia de abdomen superior, demonstracao sintetica.",
    "findings": "Texto sintetico para teste de omissao e alucinacao. Vesicula biliar com pequeno calculo movel. Sem espessamento parietal, sem liquido perivesicular e sem dilatacao das vias biliares. Figado com ecotextura preservada no exemplo.",
    "locale": "pt-BR",
    "tags": ["synthetic", "demo", "US", "abdomen"],
    "goldFindings": [
      { "finding": "calculo movel na vesicula biliar", "severity": "major" },
      { "finding": "sem espessamento parietal", "severity": "minor", "negated": true },
      { "finding": "sem dilatacao das vias biliares", "severity": "major", "negated": true }
    ],
    "referenceReport": "<center><b>ULTRASSONOGRAFIA DE ABDOMEN - EXEMPLO SINTETICO</b></center><br><b>Achados</b><br>Pequeno calculo movel na vesicula biliar. Sem sinais sinteticos de colecistite aguda ou dilatacao biliar.<br><b>Conclusao</b><br>Colelitiase no exemplo sintetico, sem sinais de complicacao descritos.",
    "criticalFindings": [],
    "guidelineExpectations": [],
    "patientContext": { "indication": "Demonstracao sintetica sem dados reais." },
    "difficulty": "easy"
  },
  {
    "id": "SYN-DEMO-004",
    "label": "Synthetic lumbar spine MRI structure demo",
    "synthetic": true,
    "schemaVersion": "1.0.0-public-synthetic",
    "exam": "Ressonancia magnetica da coluna lombar, demonstracao sintetica, sem contraste.",
    "findings": "Texto sintetico para teste de estrutura e lateralidade. Protusao discal posterior central em L4-L5, tocando o saco dural, sem compressao radicular definida. Canal vertebral de calibre preservado nos demais niveis do exemplo.",
    "locale": "pt-BR",
    "tags": ["synthetic", "demo", "MRI", "spine"],
    "goldFindings": [
      { "finding": "protusao discal posterior central em L4-L5", "location": "L4-L5", "severity": "major" },
      { "finding": "sem compressao radicular definida", "severity": "major", "negated": true }
    ],
    "referenceReport": "<center><b>RM DA COLUNA LOMBAR - EXEMPLO SINTETICO</b></center><br><b>Achados</b><br>Protusao discal posterior central em L4-L5, tocando o saco dural, sem compressao radicular definida.<br><b>Conclusao</b><br>Protusao discal central L4-L5 no exemplo sintetico, sem compressao radicular descrita.",
    "criticalFindings": [],
    "guidelineExpectations": [],
    "patientContext": { "indication": "Demonstracao sintetica sem dados reais." },
    "difficulty": "medium"
  }
]
